{
  "$schema": "https://json-schema.org/draft/2020-12/schema",
  "title": "Azure PR Review for OpenCode V2 settings",
  "type": "object",
  "additionalProperties": false,
  "required": [
    "version",
    "models"
  ],
  "properties": {
    "$schema": {
      "type": "string"
    },
    "version": {
      "const": 2
    },
    "models": {
      "type": "object",
      "additionalProperties": false,
      "required": [
        "review"
      ],
      "properties": {
        "_help": {
          "type": "object",
          "additionalProperties": false,
          "deprecated": true,
          "description": "Legacy documentation only, accepted for existing files. Omitted from new settings and removed during installation. Read README model-selection guidance instead; this field never affects model instructions.",
          "properties": {
            "functional": {
              "type": "string"
            },
            "risk": {
              "type": "string"
            },
            "verifier": {
              "type": "string"
            }
          }
        },
        "review": {
          "type": "object",
          "additionalProperties": false,
          "required": [
            "functional",
            "risk",
            "verifier"
          ],
          "properties": {
            "functional": {
              "type": "string",
              "description": "Exact provider/model ID for independent correctness review. Select for code comprehension, project language, boundary behavior, and regressions."
            },
            "risk": {
              "type": "string",
              "description": "Exact provider/model ID for independent risk review and comment planning. Select for cross-path failure analysis and reliable MCP tool use."
            },
            "verifier": {
              "type": "string",
              "description": "Exact provider/model ID for source-based verification, counterevidence, duplicate merging, and the final report. Select for evidence judgment, long context, and instruction following, not just summarization."
            }
          }
        },
        "deep": {
          "type": "object",
          "additionalProperties": false,
          "description": "Optional deep profile. Missing or empty roles disable deep mode; it never falls back to review models.",
          "properties": {
            "functional": {
              "type": "string",
              "description": "Exact provider/model ID for independent correctness review. Select for code comprehension, project language, boundary behavior, and regressions. May be empty; deep runs only when all three IDs are configured."
            },
            "risk": {
              "type": "string",
              "description": "Exact provider/model ID for independent risk review and comment planning. Select for cross-path failure analysis and reliable MCP tool use. May be empty; deep runs only when all three IDs are configured."
            },
            "verifier": {
              "type": "string",
              "description": "Exact provider/model ID for source-based verification, counterevidence, duplicate merging, and the final report. Select for evidence judgment, long context, and instruction following, not just summarization. May be empty; deep runs only when all three IDs are configured."
            }
          }
        },
        "quick": {
          "type": "object",
          "additionalProperties": false,
          "description": "Optional quick profile for /pr-quick: one reviewer per shard covers functional and risk focus, with no independent verification. An empty reviewer disables /pr-quick; it never falls back to other models.",
          "properties": {
            "reviewer": {
              "type": "string",
              "description": "Exact provider/model ID (optionally provider/model#variant) for the quick reviewer, which also plans comments for quick reviews. Select for code comprehension, evidence judgment and reliable tool use. May be empty."
            }
          }
        }
      }
    },
    "enabled": {
      "type": "boolean",
      "default": true
    },
    "outputLanguage": {
      "type": "string",
      "pattern": "^[A-Za-z]{2,3}(-[A-Za-z0-9]{2,8})*$",
      "maxLength": 63,
      "default": "en",
      "examples": [
        "en",
        "zh-TW",
        "zh-CN",
        "ja",
        "zh-Hant-TW"
      ],
      "description": "Language for human-facing initial and final reviews, comment bodies, skip reasons and AI attribution. IDs, JSON keys, code, paths, source quotes and severity tokens remain unchanged."
    },
    "returnReport": {
      "enum": [
        "receipt",
        "full"
      ],
      "default": "receipt"
    },
    "debug": {
      "type": "object",
      "additionalProperties": false,
      "required": [
        "enabled"
      ],
      "properties": {
        "enabled": {
          "type": "boolean",
          "default": false,
          "description": "Save private stage inputs, visible answers, errors, and results locally. May contain confidential source or model-echoed secrets. Only the newest debug.keepRuns run directories are kept."
        },
        "directory": {
          "type": "string",
          "default": "",
          "description": "Empty uses XDG_STATE_HOME/opencode/azpr-v2-debug (default ~/.local/state/opencode/azpr-v2-debug). Otherwise an absolute path or path relative to the active OpenCode project directory. No tilde expansion."
        },
        "keepRuns": {
          "type": "integer",
          "minimum": 0,
          "maximum": 1000,
          "default": 20,
          "description": "Run directories kept in the debug directory. When a run starts, older AZPR run directories beyond this count are deleted (never a run still active in this OpenCode process, and nothing AZPR did not create). 0 keeps every run directory."
        }
      }
    },
    "runTimeoutSeconds": {
      "type": [
        "integer",
        "null"
      ],
      "minimum": 10,
      "maximum": 7200,
      "default": null,
      "description": "Optional whole-command timeout covering all stages. Null or omitted disables it; an integer from 10 to 7200 enables it. The deadline is not reset between stages. Manual /pr-stop and per-call MCP timeouts remain available. This is not a spending cap."
    },
    "shell": {
      "enum": [
        "deny",
        "ask",
        "inherit"
      ],
      "default": "deny",
      "description": "Shell access for private reviewers and the comment planner. deny (default): shell is hidden and refused, so reviewers never run commands while reading untrusted PR content. ask: every command needs user approval in OpenCode (a background review waits for it). inherit: host permission rules decide."
    },
    "progressNotices": {
      "type": "boolean",
      "default": true,
      "description": "Queue short PROGRESS notices to the invoking conversation during long reviews and publication. They never start a model response."
    },
    "deletePrivateSessions": {
      "type": "boolean",
      "default": true,
      "description": "Delete AZPR's private reviewer sessions when they are no longer needed: a completed review's sessions when the review is evicted (the newest 20 are kept, as /pr-comment needs them), and the sessions of an unfinished review at once except the one holding its report or draft (all of them while debug is enabled); those kept sessions follow the same 20-run limit. false keeps every session."
    },
    "azure": {
      "type": "object",
      "additionalProperties": false,
      "required": [
        "organization",
        "pat"
      ],
      "description": "Azure DevOps REST access (api-version 7.1) shared by all AZPR workflows in one OpenCode process. No MCP server is used.",
      "properties": {
        "organization": {
          "type": "string",
          "pattern": "^[A-Za-z0-9][A-Za-z0-9-]{0,49}$",
          "description": "Azure DevOps organization name: the <org> in https://dev.azure.com/<org>. PR URLs of other organizations are refused."
        },
        "pat": {
          "type": "string",
          "minLength": 20,
          "description": "Personal access token for that organization (scopes: Code Read; Pull Request Threads Read & write). Sent only to https://dev.azure.com/<org> and never logged. Keep this file private (mode 600)."
        },
        "concurrency": {
          "type": "integer",
          "minimum": 1,
          "maximum": 8,
          "default": 3,
          "description": "Simultaneous Azure DevOps calls across all AZPR workflows. This limits parallelism, never total work."
        },
        "callTimeoutSeconds": {
          "type": "integer",
          "minimum": 10,
          "maximum": 1800,
          "default": 120,
          "description": "Per-call timeout. A hung call is aborted and its slot released so other reviews keep running; reads are retried."
        },
        "archiveMegabytes": {
          "type": "integer",
          "minimum": 1,
          "maximum": 1024,
          "default": 100,
          "description": "Largest repository zip that content search (azpr_search_code) downloads per run and commit. A larger repository is not searched; the rest of the review is unaffected. The archive is held in memory while a review runs."
        },
        "proxy": {
          "type": "string",
          "maxLength": 2048,
          "default": "",
          "description": "Forward proxy for AZPR's Azure DevOps calls only, e.g. http://proxy.example.com:8080; credentials go in the URL as http://user:password@host:port (percent-encoded) and are never shown. HTTPS requests are tunnelled with CONNECT, so the proxy sees the host name but not the PAT unless it inspects TLS. Empty: no AZPR proxy; HTTPS_PROXY and NO_PROXY in OpenCode's environment still apply."
        },
        "caFile": {
          "type": "string",
          "default": "",
          "description": "Absolute path of a PEM file with CA certificates that AZPR trusts in addition to the built-in roots, for a proxy that inspects HTTPS. Read when OpenCode loads AZPR; restart OpenCode after changing it."
        },
        "verifyTls": {
          "type": "boolean",
          "default": true,
          "description": "false turns off certificate checks for AZPR's Azure DevOps calls (like curl -k): anyone who can intercept the connection can then read the PAT. Last resort when the proxy's CA certificate cannot be obtained; prefer caFile. /pr-check shows a warning while it is off."
        }
      }
    },
    "workflow": {
      "type": "object",
      "additionalProperties": false,
      "description": "Review sharding, repair and retry behavior.",
      "properties": {
        "shardFiles": {
          "type": "integer",
          "minimum": 1,
          "maximum": 1000,
          "default": 25,
          "description": "Changed files per initial-review session. A shard that hits its context limit is split automatically."
        },
        "shardFindings": {
          "type": "integer",
          "minimum": 1,
          "maximum": 500,
          "default": 15,
          "description": "Candidate findings per verification session."
        },
        "parallelSessions": {
          "type": "integer",
          "minimum": 1,
          "maximum": 16,
          "default": 4,
          "description": "Reviewer sessions running at the same time within one command."
        },
        "repairAttempts": {
          "type": "integer",
          "minimum": 0,
          "maximum": 3,
          "default": 2,
          "description": "Correction turns in the same session when an answer does not meet the output contract. Remaining problems degrade per item."
        },
        "stageRetries": {
          "type": "integer",
          "minimum": 0,
          "maximum": 2,
          "default": 1,
          "description": "New-session retries after a transient execution failure (provider 429/5xx, interrupted stream) or a stop by the inactivity watchdog."
        },
        "stageIdleSeconds": {
          "type": "integer",
          "anyOf": [
            {
              "const": 0
            },
            {
              "minimum": 60,
              "maximum": 7200
            }
          ],
          "default": 600,
          "description": "Stage inactivity watchdog: a reviewer stage that shows no activity (prompt admission, model request, streamed output, tool start or end, approval request, announced host retry) for this many seconds while it waits on OpenCode is stopped with an error that says so (failure=idle) and retried in a new session (stageRetries). Any activity restarts the window, so long stages that keep working, including a long answer that keeps streaming, are never cut. 0 turns it off. With shell allowed, an approval or a command that takes longer counts as inactivity."
        }
      }
    }
  }
}
