{
  "$schema": "./settings.schema.json",
  "version": 2,
  "models": {
    "review": {
      "functional": "REPLACE_PROVIDER/REPLACE_FUNCTIONAL",
      "risk": "REPLACE_PROVIDER/REPLACE_RISK",
      "verifier": "REPLACE_PROVIDER/REPLACE_VERIFIER"
    },
    "deep": {
      "functional": "",
      "risk": "",
      "verifier": ""
    }
  },
  "enabled": true,
  "returnReport": "receipt",
  "debug": {
    "enabled": false,
    "directory": "",
    "keepRuns": 20
  },
  "outputLanguage": "en",
  "runTimeoutSeconds": null,
  "shell": "deny",
  "progressNotices": true,
  "deletePrivateSessions": true,
  "azure": {
    "organization": "",
    "pat": "",
    "concurrency": 3,
    "callTimeoutSeconds": 120,
    "archiveMegabytes": 100,
    "proxy": "",
    "caFile": "",
    "verifyTls": true
  },
  "workflow": {
    "shardFiles": 25,
    "shardFindings": 15,
    "parallelSessions": 4,
    "repairAttempts": 2,
    "stageRetries": 1,
    "stageIdleSeconds": 600
  }
}
